"Post ID","Account ID","Account username","Account name",Description,"Duration (sec)","Publish time",Permalink,"Post type","Data comment",Date,Views,Likes,Shares,Comments,Saves,Reach,Follows
18423939541112425,17841400079643420,barkerandstonehouse,"Barker and Stonehouse","Christmas has arrived in @moveinwithmelissa's home and our Capella dining table is the perfect centrepiece for festive gatherings 🎄

Is your house a Barker and Stonehouse? Tag us in your posts to be featured!",0,"12/02/2025 09:50",https://www.instagram.com/p/DRxSNF2khzo/,"IG image",,Lifetime,16799,97,3,2,14,4645,0
18069997019373997,17841400079643420,barkerandstonehouse,"Barker and Stonehouse","Behind the scenes of our nostalgia-filled Christmas shoot ✨

We invited our creative team’s little ones onto set for a fun-filled, festive day, full of laughter, play, and those perfectly imperfect moments that make Christmas so special. 

Step into the magic with us 🎄",40,"12/01/2025 10:30",https://www.instagram.com/reel/DRuyC19jBfV/,"IG reel",,Lifetime,7215,63,8,1,2,5826,0
18178798567364528,17841400079643420,barkerandstonehouse,"Barker and Stonehouse","From deep forest to soft khaki, our latest sofa arrivals are looking gorgeous in green 🌿 Subtle, versatile, and effortlessly stylish, it’s a palette we’re really loving right now.",0,"11/30/2025 07:05",https://www.instagram.com/p/DRr1u6qjX-2/,"IG carousel",,Lifetime,19013,59,16,2,25,5572,5
18071582885612059,17841400079643420,barkerandstonehouse,"Barker and Stonehouse","Take a peek at some of our favourite in-store finds this Black Friday weekend ✨🖤

Enjoy 15% off all in-stock furniture and home accessories and an extra 10% off clearance furniture until Monday.",27,"11/28/2025 06:30",https://www.instagram.com/reel/DRmoJKNDFEP/,"IG reel",,Lifetime,8232,57,5,0,8,6469,1
17996381741848092,17841400079643420,barkerandstonehouse,"Barker and Stonehouse","Meal times made more stylish with the Kalmer dining table ✨

Thanks for sharing @our.kirkleyhome!",0,"11/25/2025 09:30",https://www.instagram.com/p/DRfOXXskgDc/,"IG image",,Lifetime,15151,45,4,3,10,3821,1
17947808327932867,17841400079643420,barkerandstonehouse,"Barker and Stonehouse","Dreaming of settling into a new sofa by Christmas? Choose from our selected range, available in time for the festivities 🎄✨ 

Order soon to have your home ready for cosy mornings, family gatherings, and all the little moments that make the season feel magical!",0,"11/24/2025 09:02",https://www.instagram.com/p/DRcmYxIkl5x/,"IG image",,Lifetime,14122,31,8,0,7,3578,0
18097069192840676,17841400079643420,barkerandstonehouse,"Barker and Stonehouse","Final day of Autumn Offers! 🍁Swipe to shop our favourite picks of the season - all with up to 20% off.",0,"11/23/2025 01:00",https://www.instagram.com/p/DRZKcKkjPOF/,"IG carousel",,Lifetime,17495,40,0,0,6,4578,0
18009600353643419,17841400079643420,barkerandstonehouse,"Barker and Stonehouse","Visit our Knaresborough store with us📍

From cosy coffee breaks at Stanley's, to our latest styles and favourite furniture brands, there's always something new to discover ☕️✨ 

Don’t forget, this weekend is your last chance to shop our autumn offers in store! Visit now to see what you can save.",39,"11/22/2025 01:00",https://www.instagram.com/reel/DRFlSKwDIN4/,"IG reel",,Lifetime,8882,73,15,2,5,6359,2
18060384839220659,17841400079643420,barkerandstonehouse,"Barker and Stonehouse","Autumn dining never looked so good 🍂

Discover our top picks for cosy gatherings this season - all with up to 20% off. 

Which look is your favourite?",0,"11/21/2025 09:10",https://www.instagram.com/p/DRU45wUkq32/,"IG carousel",,Lifetime,14525,36,0,0,7,2888,0
18047070227426652,17841400079643420,barkerandstonehouse,"Barker and Stonehouse","Making Autumn Happen 🍂

People are the life and soul of our business. Here we share some of the contributors to this season and beyond, from product to creative development and all the people in between!

Visit our website to find out more about the faces behind our brand.",0,"11/19/2025 10:10",https://www.instagram.com/p/DRNRYPYjPOp/,"IG carousel",,Lifetime,20548,134,40,8,4,5406,2
18059924666240692,17841400079643420,barkerandstonehouse,"Barker and Stonehouse","Cosy nights start here 🍂✨🕯️

Style our Connie sofa with us as we layer warm tones, snuggly textures and soft lighting for the perfect cosy moment.

Order now and get Connie in time for Christmas!",42,"11/18/2025 10:30",https://www.instagram.com/reel/DRP4cDADLUa/,"IG reel",,Lifetime,34502,238,52,1,102,25436,307
18117936535553458,17841434051990545,my.lymingtonhome,"Shannon • Home DIY & Lifestyle 🤍","AD This is one of my favourite spaces in the house so it truly deserved a coffee table as stunning as this!

I chose this acacia wood coffee table from @barkerandstonehouse and it’s absolutely perfect ✨ 

#ad #coffeetable #barkerandstonehouse #newhome #newhouse #firsttimebuyer #kitchen #livingroom",61,"11/17/2025 09:30",https://www.instagram.com/reel/DRKnybxgm-G/,"IG reel",,Lifetime,166771,523,36,87,0,264068,63
18065672855432570,17841400079643420,barkerandstonehouse,"Barker and Stonehouse","In the spotlight 🔥 

Orange sofas are having a major moment - bringing instant warmth, personality, and statement style to any space. 

Swipe to see our favourite picks!",0,"11/17/2025 08:42",https://www.instagram.com/p/DRKigQxjCQV/,"IG carousel",,Lifetime,15236,32,13,0,13,3360,0
17873841591448330,17841400079643420,barkerandstonehouse,"Barker and Stonehouse","“I love to combine old and new; a balance of vintage finds, family heirlooms or old photographs alongside more contemporary accessories that tell a personal story.” - @rebeccadeboehmler.stylist

There’s beauty in blending eras - creating spaces that feel collected, not coordinated. This autumn, we’re embracing the art of layering: rich textures, timeless pieces, and contemporary touches that bring warmth and story to every corner 🤎🍂",0,"11/14/2025 09:45",https://www.instagram.com/p/DRC7VX1mOVU/,"IG carousel",,Lifetime,15517,28,2,1,5,3108,0
18118337701480050,17841400079643420,barkerandstonehouse,"Barker and Stonehouse","Ever wondered how to make vintage pieces shine in a modern interior? ✨

Our creative stylist Rhianon sat down with Selina from Cabbage Patch Antiques to chat all things vintage, from sourcing unique treasures to styling old and new 🕰️💫",57,"11/12/2025 10:02",https://www.instagram.com/reel/DQ9zIy6jDAf/,"IG reel",,Lifetime,7892,88,80,59,1,5236,14
17866786740420963,17841400079643420,barkerandstonehouse,"Barker and Stonehouse","A well-curated cabinet does more than store - it tells a story. Each piece adds depth, memory, and meaning to your home 🤎

Our Sorrel cabinet has been styled a mix of new-season finds and timeless antiques, styled to celebrate both the present and the past. We’ve even woven in a little of our own history, including vintage shop photos and a portrait of Charles Barker, original partner and James’ grandfather, competing in the 1931 Scottish Six Days’ Motorcycle Trial.",0,"11/11/2025 10:10",https://www.instagram.com/p/DQ7P0V8Dylu/,"IG carousel",,Lifetime,19213,80,13,4,12,4357,1
18011461496637382,17841470052833390,monkeymews_,"Imogen | MonkeyMews","Excited to reveal that I’ve teamed up with @barkerandstonehouse ✨ Their beautifully crafted pieces have turned this empty nook into a warm, inviting retreat.

Ad | Gifted*
*Cream Boucle Armchair
*Natural & Black Woven Cushion
*Umber Brown Cushion
*Potted Olive Tree

What’s your favourite piece?! 

#barkerandstonehouse #homeinspo #bouclechair #cosycorners #olivetree #interiors #interiordesign #home #homedecor #homesweethome #homestyle #interiordecor #peakdistrict #mews",23,"11/11/2025 09:00",https://www.instagram.com/reel/DQ7G_YZiCw9/,"IG reel",,Lifetime,26709,289,15,150,0,,
18067761689614772,17841400079643420,barkerandstonehouse,"Barker and Stonehouse","There’s a quiet joy in slowly and lovingly collecting and curating meaningful pieces over the years 🕰️

Whether it’s a timeworn vase discovered at an antique market, a cherished family heirloom passed down through generations, or a memento tied to a moment you don’t want to forget, each one tells its own story. Rather than storing these objects away, display them artfully in a glass-fronted cabinet to surround yourself with memories and modern day treasures.",16,"11/10/2025 09:50",https://www.instagram.com/reel/DQ4oyW7DKm4/,"IG reel",,Lifetime,4995,19,3,1,4,4203,1
18092341009859469,17841400079643420,barkerandstonehouse,"Barker and Stonehouse","We love how our Zuberi Dining Table brings natural texture and style to this stunning setup by @our.bellway.chandler 🤎

Is your house a Barker and Stonehouse? Tag us in your posts to be featured!",0,"11/09/2025 08:05",https://www.instagram.com/p/DQ135YaksKq/,"IG image",,Lifetime,17801,64,7,4,15,4135,2
17935772547099822,17841400079643420,barkerandstonehouse,"Barker and Stonehouse","We believe that if you buy well, you only need to buy once 🏠

That means investing in furniture that’s been thoughtfully designed, hand crafted and sustainably sourced. Furniture that’s flexible and grows with your family. Furniture that ages with you and ages well, for looks that last.",21,"11/08/2025 02:00",https://www.instagram.com/reel/DQypXyNjNPu/,"IG reel",,Lifetime,23241,182,12,2,37,17685,389
17931084255109113,17841400079643420,barkerandstonehouse,"Barker and Stonehouse","Cosy season, sorted 🍂 The Mills swivel chair brings comfort and style to every corner.

Order now and get it in time for Christmas 🎄",0,"11/06/2025 10:01",https://www.instagram.com/p/DQuWyaRkfC5/,"IG carousel",,Lifetime,17372,28,3,2,11,3006,3
18156237241404421,17841411836366164,bethanyhome_,"Bethany Tyson","ad | completing a space with @barkerandstonehouse 🤍 the marble coffee table of dreams ☁️ 

#home #homeinterior #homedecor",22,"11/06/2025 08:27",https://www.instagram.com/reel/DQuLiyhAn-l/,"IG reel",,Lifetime,161786,413,15,101,0,,
18048632105342059,17841400079643420,barkerandstonehouse,"Barker and Stonehouse","Introducing Prism, the bold and beautiful latest addition to our @orlakiely furniture collection 🌼 We sat down with Orla Kiely herself to dive into the inspiration behind this stunning new print.",34,"11/05/2025 09:50",https://www.instagram.com/reel/DQrwMNmEkFW/,"IG reel",,Lifetime,2792,23,0,0,1,2563,0
18027999617751641,17841400079643420,barkerandstonehouse,"Barker and Stonehouse","Set the scene for your most stylish Christmas yet 🎄✨

Order selected items now for delivery in time for the big day and enjoy furniture made for Christmas mornings, family dinners and everything in between!",20,"11/04/2025 10:30",https://www.instagram.com/reel/DQpQhX2DLwQ/,"IG reel",,Lifetime,47520,310,55,1,51,34957,892
18333411577226619,17841400079643420,barkerandstonehouse,"Barker and Stonehouse","As seen in the November issue of @housebeautifuluk, our Zerina sideboard brings mid-century modern style to any space 🤎

Art direction @sarahkeadyuk 
Photography : Oli Douglas 
Stylist @rebeccadeboehmler.stylist",0,"11/02/2025 02:00",https://www.instagram.com/p/DQjMmqBDzGT/,"IG carousel",,Lifetime,17836,45,4,1,13,3164,1
18392495668134339,17841400079643420,barkerandstonehouse,"Barker and Stonehouse","As the evenings draw in, embrace the slow moments ✨🌙 Layer natural textures, muted tones, and soft lighting for a bedroom that feels calm and effortlessly cosy.",0,"10/31/2025 10:01",https://www.instagram.com/p/DQezL4pj2Fd/,"IG carousel",,Lifetime,17919,33,0,0,12,3006,0
18109604197598507,17841400079643420,barkerandstonehouse,"Barker and Stonehouse","Nature knows best 🌿

This season, we’re loving furniture that follows its lead - fluid lines, natural textures, and organic patterns that bring calm to every space.",9,"10/30/2025 10:25",https://www.instagram.com/reel/DQcRLOfDLUo/,"IG reel",,Lifetime,4937,36,0,4,6,4173,0
18061242536407643,17841400079643420,barkerandstonehouse,"Barker and Stonehouse","Your dining room, your way ✨

From cosy corner benches to stylish table and chair set ups, we love seeing how you make our pieces your own. Swipe for some real-home ideas to spark inspiration!

@our_durham_home
@aimeexhome
@oursurreycorner
@hill_family_home
@ouraspey_abode
@the_durham_derwent

Is your house a Barker and Stonehouse? Tag us to be featured! 📷",0,"10/28/2025 10:11",https://www.instagram.com/p/DQXF7PjkzlF/,"IG carousel",,Lifetime,20606,70,10,0,12,4017,4
18085376318296793,17841400079643420,barkerandstonehouse,"Barker and Stonehouse","In your home for Christmas 🎄

Bring the joy of colour into your home this festive season with our Ainsley corner sofa. Order now for delivery before the big day!",0,"10/27/2025 09:52",https://www.instagram.com/p/DQUe5JtEybZ/,"IG carousel",,Lifetime,17901,28,0,0,4,2937,0
18084608764957495,17841400079643420,barkerandstonehouse,"Barker and Stonehouse","One table, three moods ☁️💙🌻

Cosy neutral, bold blue or sunny yellow - which chair would you choose?",0,"10/26/2025 10:45",https://www.instagram.com/p/DQSAOQOk-KZ/,"IG carousel",,Lifetime,18934,42,4,1,9,3732,0
17966821757972058,17841400079643420,barkerandstonehouse,"Barker and Stonehouse","We believe that style is human 👫

Your home should feel like you - a space that tells your story and celebrates your own sense of cool.",17,"10/26/2025 09:00",https://www.instagram.com/reel/DQR0OCojKKU/,"IG reel",,Lifetime,3993,36,5,0,3,3477,0
18061737029170993,17841400079643420,barkerandstonehouse,"Barker and Stonehouse","This autumn is all about pattern and colour and no one does this quite like @orlakiely 🌼

Renowned for her bold motifs and uplifting use of colour, her work is a timeless masterclass in breathing life into your space. 

We caught up with Orla to learn more about her two new designs: Arklow and Ebben.

Shop the collection now online and in stores!",39,"10/25/2025 02:00",https://www.instagram.com/reel/DQOfWZ1DIIH/,"IG reel",,Lifetime,4437,35,3,1,2,3499,3
18544107124029617,17841400079643420,barkerandstonehouse,"Barker and Stonehouse","Gallery wall glow-up ✨

Gallery walls are trending again - but with a modern twist. Mix it up, make it personal, and play with shapes and sizes for an effortless yet curated look.",0,"10/23/2025 10:01",https://www.instagram.com/p/DQKM1HbjYHX/,"IG carousel",,Lifetime,16286,30,1,1,5,2350,0
18109166848592979,17841400079643420,barkerandstonehouse,"Barker and Stonehouse","Our Rico tiled coffee table steals the spotlight in this beautiful autumn-inspired shoot for @housebeautifuluk 🍁

Art direction @sarahkeadyuk
Photography @sibev 
Stylist @rebeccadeboehmler.stylist",0,"10/22/2025 08:35",https://www.instagram.com/p/DQHeNBjk7s1/,"IG carousel",,Lifetime,15152,37,9,3,12,1980,1
18069487499350832,17841400079643420,barkerandstonehouse,"Barker and Stonehouse","This season’s pattern obsession? Chequerboard and grid everything. From eye-catching rugs to must-have tiled tables, it’s the perfect way to add texture and personality to any space.",9,"10/21/2025 08:00",https://www.instagram.com/reel/DQE1ZnYDD_q/,"IG reel",,Lifetime,3382,40,5,4,4,2871,1
18422615785110200,17841400079643420,barkerandstonehouse,"Barker and Stonehouse","One timeless sofa, two ways to style it ✨

The Hemingway leather sofa is as versatile as it is stylish. Which is your favourite look?",0,"10/20/2025 11:42",https://www.instagram.com/p/DQClYnlj1Sj/,"IG carousel",,Lifetime,17638,33,4,1,6,3197,0
18007386278642860,17841400079643420,barkerandstonehouse,"Barker and Stonehouse","GIVEAWAY CLOSED

We’re celebrating the launch of our new Barker and Stonehouse x Linwood collection with a special giveaway! Win a stylish Runa armchair, custom-made in your favourite @linwood_fabric fabric.

Here’s how to enter:

✅ Like this post
✅ Follow @barkerandstonehouse and @linwood_fabric
✅ Tag a friend who’d love to win too

Good luck!

The winner will be chosen at random and will be notified by the official @barkerandstonehouse Instagram account within 3 days of the giveaway closing. T&Cs apply, visit our website for more information. Open to mainland UK residents only.",0,"10/19/2025 01:00",https://www.instagram.com/p/DP8W62HDHr6/,"IG image",,Lifetime,56174,1456,382,1887,148,12735,427
18134256760460386,17841400079643420,barkerandstonehouse,"Barker and Stonehouse","Your most stylish Christmas awaits ✨

Order now to ensure your pieces arrive in time for the festive season. With cut-off dates fast approaching for many made-to-order items, now is the time to make your home truly magical this Christmas 🎄",0,"10/18/2025 01:00",https://www.instagram.com/p/DP8W-qMDTWY/,"IG image",,Lifetime,17207,29,0,0,5,2988,0
18081458938995830,17841400079643420,barkerandstonehouse,"Barker and Stonehouse","From cosy corners to statement spaces, we love seeing how you style our sofas 😍

@leopard_print_stairs
@georgestreet_interiors
@behind_the_door_at_ronnies
@hoppshouse
@atjadeshouse
@montrose.terrace
@houseofe17

Is your house a Barker and Stonehouse? Tag us to be featured! 📷",0,"10/17/2025 08:55",https://www.instagram.com/p/DP6oetoj89o/,"IG carousel",,Lifetime,28011,150,5,1,27,7455,3
18086270486507813,17841400079643420,barkerandstonehouse,"Barker and Stonehouse","From sleek lines to snuggly textures, meet this season’s standout armchairs ☕🤎

Which would you like to cosy up in?",0,"10/16/2025 08:45",https://www.instagram.com/p/DP4Cj_EjHa4/,"IG carousel",,Lifetime,17519,46,5,1,8,2685,0
17894100009196351,17841400079643420,barkerandstonehouse,"Barker and Stonehouse","Discover our brand new collection in collaboration with @linwood_fabric ✨

Linwood is a long-standing British designer fabric brand, renowned for its passion for colour and pattern.  For this collection, we’ve taken some of our bestselling dining chairs and armchairs, as well as our new upholstered headboards and beds, and reimagined them in a distinctive edit of Linwood’s luxurious fabrics. Each piece is expertly tailored to your style, here in Britain.

Barker and Stonehouse x Linwood is available online and in store now!",19,"10/14/2025 07:23",https://www.instagram.com/reel/DPyvBdJDH7z/,"IG reel",,Lifetime,40105,307,28,6,66,26829,468
18092917114769892,17841400079643420,barkerandstonehouse,"Barker and Stonehouse","Colour trends and textures you need to know this autumn 🍂 

From hand-woven details to organic tones with a foodie feel, we’re sharing our favourite colours and textures for the season. Which looks do you love?",15,"10/13/2025 08:50",https://www.instagram.com/reel/DPwUxZZDLc1/,"IG reel",,Lifetime,21761,206,21,0,60,16293,330
18040802660468326,17841400079643420,barkerandstonehouse,"Barker and Stonehouse","Calm, timeless, and effortlessly chic, we’ll always have a soft spot for neutral interiors 🤍 

Swipe through to see some of our favourite looks from your homes, proving that neutrals never go out of style.

@connornewton01
@ouraspey_abode
@bungalowbythebeach
@oursurreycorner
@bungalowbythebeach
@aimeexhome
@north_east_home_reno
@our_durham_home",0,"10/12/2025 08:01",https://www.instagram.com/p/DPtqQZgE7aW/,"IG carousel",,Lifetime,29417,183,11,6,48,7257,1
18403252699187579,17841400079643420,barkerandstonehouse,"Barker and Stonehouse","From flickering candles to autumn feasts, cosy nights in are best gathered round the table🍷🥖",20,"10/11/2025 06:00",https://www.instagram.com/reel/DPq3qn6jFQ5/,"IG reel",,Lifetime,3322,45,9,4,5,2738,1
18092522335887585,17841400079643420,barkerandstonehouse,"Barker and Stonehouse","From the 90s to now ✨ 

We love this story from @firsthouseblues. Decades since they were first bought, Claire's parents' coffee table and mirror are still going strong - a reminder that when you buy well, you only have to buy once.",0,"10/09/2025 09:01",https://www.instagram.com/p/DPmCyW_EWvc/,"IG carousel",,Lifetime,45411,118,4,5,8,17744,1
18386537707134043,17841400079643420,barkerandstonehouse,"Barker and Stonehouse","Cosy up this autumn with our new look, Warm Contemporary 🤎

Surround yourself with a symphony of rich tones, warm neutrals and dark wooden finishes for a harmonious and inviting space.",0,"10/08/2025 10:30",https://www.instagram.com/p/DPjoNhzDbLi/,"IG carousel",,Lifetime,18796,48,4,2,10,3444,2
18040723571427051,17841400079643420,barkerandstonehouse,"Barker and Stonehouse","Embrace the season’s palette with our Warm Contemporary trend, where sleek modern lines meet cosy textures and rich tones ✨

Dark woods, fluted accents, and deep chocolate browns create a sophisticated yet inviting atmosphere, blending comfort and style with effortless ease.",23,"10/07/2025 09:45",https://www.instagram.com/reel/DPg-QHzDOUx/,"IG reel",,Lifetime,29958,207,9,4,46,21236,361
18106945438594570,17841400079643420,barkerandstonehouse,"Barker and Stonehouse","From sculptural silhouettes to bold tiled designs, explore this season’s most stylish occasional tables ☕",0,"10/06/2025 07:01",https://www.instagram.com/p/DPeGsOnjIWR/,"IG carousel",,Lifetime,16384,25,5,1,3,2294,3
18067879085215041,17841400079643420,barkerandstonehouse,"Barker and Stonehouse","The best tables don’t just hold things, they hold memories. From little hands drawing to nights in with friends, our tables are made every chapter of life 📚 🍷🌈",0,"10/05/2025 05:25",https://www.instagram.com/p/DPbW6evjFjz/,"IG carousel",,Lifetime,18643,40,7,5,3,3340,1
18109739047571203,17841400079643420,barkerandstonehouse,"Barker and Stonehouse","Cosy corners are even better with our Hemingway sofa in plush velvet 😍 Thanks for sharing your lovely space, @atjadeshouse! 

Is your house a Barker and Stonehouse? Tag us in your posts to be featured!",0,"10/04/2025 08:25",https://www.instagram.com/p/DPZGtGHk2m-/,"IG image",,Lifetime,19336,45,2,1,8,3860,1
18011453816802657,17841400079643420,barkerandstonehouse,"Barker and Stonehouse","We’re excited to introduce the Barker and Stonehouse x Linwood edit! 🎉

This exciting collaboration between two family businesses brings bold Linwood patterns to life across dining chairs, accent chairs and beds. A celebration of colour, texture, and design.

Shop the full collection now in Barker and Stonehouse stores and online.",0,"10/03/2025 03:52",https://www.instagram.com/p/DPWCqivjFtG/,"IG carousel",,Lifetime,46887,104,10,5,10,8837,4
18087034453698107,17841400079643420,barkerandstonehouse,"Barker and Stonehouse","How to style a gallery wall 🎨

A gallery wall isn’t just décor, it’s the perfect way to add your own personal touch to a room. Every frame, artwork and object is a reflection of who you are and what you love.

From choosing a layout to finding the perfect mix of pieces, we’re sharing our top tips to help you create a gallery wall that feels polished, personal, and uniquely you!",20,"10/02/2025 09:00",https://www.instagram.com/reel/DPUBKl6jJ8m/,"IG reel",,Lifetime,2852,28,3,1,8,2525,0
17931433556985006,17841400079643420,barkerandstonehouse,"Barker and Stonehouse","Create your own warmth this season with our new look, Organic Joy 🌈

From earthy greens to playful pinks, harness the energising power of colour and reimagine your home as a canvas for confidence and self-expression.",0,"10/01/2025 08:10",https://www.instagram.com/p/DPRWp95DNHs/,"IG carousel",,Lifetime,17403,39,2,1,13,2738,0
18056301434536413,17841400079643420,barkerandstonehouse,"Barker and Stonehouse","Embrace Organic Joy this autumn with our latest look 🌸🌿

Harness the energising power of colour and reimagine the home as a canvas for confidence and self-expression. Take an eclectic approach to decorating and create a richly layered and deeply personal space.",22,"09/30/2025 11:00",https://www.instagram.com/reel/DPO7CW_jDtr/,"IG reel",,Lifetime,32176,250,16,1,60,22119,449
18132945103449933,17841400079643420,barkerandstonehouse,"Barker and Stonehouse","Autumn is… all about the cosy sounds 🍂 the rustle of cushions, the softness of fabric and the quiet touch of textures that make home feel like a hug.

What's your favourite autumn sound?",17,"09/29/2025 10:00",https://www.instagram.com/reel/DPMZnXLjMkA/,"IG reel",,Lifetime,4862,45,4,3,7,4003,2
18035632214651350,17841455945417732,ourberkelyhome,"Abbey | Our Berkely Home✨","AD| adding those autumn touches 🍂🤎
-
layering some gorgeous brown textures to the space to give it that cosy feel🫶🏻
-
Our stunning mango wood marble side table, rattan lamp, soft furnishings, mini vases, marble tray & stone bowl are from the amazing @barkerandstonehouse 🤍
-
They complement our living room perfectly and we are so ready for cosy evenings at home as a family. 🍂🤎

#sidetables #sidetabledesign #sidetabledecor #sidetablestyling #livingroom #livingroominterior #livingroomdécor #homestylinginspo #homestyle #stylingreels #softfurnishings #homeaccesories #neutralhomedecor #neutralhomesfeature #neutralhomestolove",25,"09/28/2025 01:26",https://www.instagram.com/reel/DPI51B7jEzQ/,"IG reel",,Lifetime,9937,168,80,58,0,,
18079620601957961,17841400079643420,barkerandstonehouse,"Barker and Stonehouse","Your autumn inspo just dropped! 🍂

Take a look inside our autumn brochure, where you’ll find our new season collections and exclusive pieces, including a collaboration that blends crafted design with classic British flair. Plus, a conversation with one of our most recognisable design partners.

Whether you’re updating a room or reimagining your whole home, now’s the time to get inspired.

Grab a copy in store, or click the link in our bio to order yours!",15,"09/27/2025 01:00",https://www.instagram.com/reel/DPB_nt-jKEI/,"IG reel",,Lifetime,5169,56,8,2,4,4075,0
