"Post ID","Account ID","Account username","Account name",Description,"Duration (sec)","Publish time",Permalink,"Post type","Data comment",Date,Views,Likes,Shares,Comments,Saves,Reach,Follows
18074404700128908,17841400079643420,barkerandstonehouse,"Barker and Stonehouse","Looking for real-life dining room inspiration? You’ve just found it ✨🍽️

@life_at_the_lodge
@intheavenue_
@amelias.lifestyle.x
@our2025foreverhome
@homebyamyx

Is your home styled with Barker and Stonehouse? Tag us in your posts for the chance to be featured.",0,"02/28/2026 09:01",https://www.instagram.com/p/DVTygWRGmN6/,"IG carousel",,Lifetime,4745,29,1,3,7,2279,1
17941914396126463,17841400079643420,barkerandstonehouse,"Barker and Stonehouse","Meet the G Plan Winchester bedroom range, where timeless craftsmanship meets effortless mid-century style✨",0,"02/25/2026 09:22",https://www.instagram.com/p/DVMGgtBDYT3/,"IG carousel",,Lifetime,4761,24,2,0,4,2373,1
17984933429958312,17841400079643420,barkerandstonehouse,"Barker and Stonehouse","Terracotta and blue = the perfect colour combination 😍

Thanks for sharing @mariahaslien

Is your house a Barker and Stonehouse? Don't forget to tag us in your posts!",0,"02/22/2026 06:40",https://www.instagram.com/p/DVEFrWxlMkS/,"IG carousel",,Lifetime,11892,171,18,2,42,5862,0
18066705104262903,17841400079643420,barkerandstonehouse,"Barker and Stonehouse","The perfect balance of comfort and style ✨

The Montgomery sofa doesn’t just look the part; it’s thoughtfully designed for the way you live. With smooth power recline and adjustable headrests, built-in USB charging and sink-in, cloud-like comfort, it’s luxury you can truly relax into.",0,"02/20/2026 10:02",https://www.instagram.com/p/DU_TKySmjjM/,"IG carousel",,Lifetime,5438,35,4,0,8,2847,0
17851101063635254,17841400079643420,barkerandstonehouse,"Barker and Stonehouse","Soft curves, warm oak tones and the cutest accessory ✨

Our Cecile dressing table is the perfect addition to @the.stoneham's bedroom.

Is your house a Barker and Stonehouse? Tag us in your posts to be featured!",0,"02/18/2026 09:30",https://www.instagram.com/p/DU6F649GrOU/,"IG image",,Lifetime,4246,41,3,2,8,2656,0
18094226074789764,17841400079643420,barkerandstonehouse,"Barker and Stonehouse","One table, styled two ways ✨

Soft neutrals for a calm, timeless feel, or a bold pop of colour to make a statement.

Which look would you choose?",0,"02/17/2026 09:55",https://www.instagram.com/p/DU3j_lSjmnY/,"IG carousel",,Lifetime,4948,32,3,1,0,2376,0
18329571532175542,17841400079643420,barkerandstonehouse,"Barker and Stonehouse","Styling a cosy night in 💐💘

Set the scene for staying in, with soft touches, something sweet and a seat that’s perfect for sharing…",28,"02/14/2026 01:30",https://www.instagram.com/reel/DUu70vXDgpQ/,"IG reel",,Lifetime,7312,132,23,13,16,5895,5
17910526077319509,17841400079643420,barkerandstonehouse,"Barker and Stonehouse","Forever in style 🤎

A leather sofa never goes out of fashion, it just gets better with age. Classic, lived-in, and still right on trend.

Shop styles such as the Epping, now in our Winter Sale.",0,"02/12/2026 09:55",https://www.instagram.com/p/DUqsBRrlpqS/,"IG carousel",,Lifetime,8442,41,0,0,7,3648,0
17877204516396493,17841400079643420,barkerandstonehouse,"Barker and Stonehouse","From sculptural silhouettes to bold prints and tactile textures, our statement chairs bring personality to every room. Perfect for a new-season refresh ✨",0,"02/11/2026 10:30",https://www.instagram.com/p/DUoLPnfGjgq/,"IG carousel",,Lifetime,7599,31,1,0,4,2917,1
18087209840326943,17841400079643420,barkerandstonehouse,"Barker and Stonehouse","The Lomax sofa, in detail 🤍

Combining clean lines, a soft neutral fabric, and a contemporary modular design, the Lomax is made to stretch out and stay awhile.",0,"02/08/2026 08:55",https://www.instagram.com/p/DUgR-ZOmpAq/,"IG carousel",,Lifetime,8532,33,8,0,6,3126,4
18087696686150641,17841400079643420,barkerandstonehouse,"Barker and Stonehouse","We’re having a spring clean ✨

Save up to 60% off sofas, dining and more in store this weekend. When they’re gone, they’re gone so be quick!

Our drivers are already on standby so get the kettle on, we’ll be round in a flash ☕️",10,"02/06/2026 00:56",https://www.instagram.com/reel/DUaQD8gDCP9/,"IG reel",,Lifetime,14396,76,39,0,5,21455,1
18561584905043966,17841400079643420,barkerandstonehouse,"Barker and Stonehouse","Save up to 20% off timeless Ercol furniture this winter ❄️ 

Renowned for its craftsmanship, natural materials, and classic style, discover beautifully made pieces including the iconic Stack coffee table.",0,"02/04/2026 09:45",https://www.instagram.com/p/DUWEhhyEmwe/,"IG carousel",,Lifetime,7358,24,0,0,5,2036,0
18031812191586959,17841400079643420,barkerandstonehouse,"Barker and Stonehouse","2026 is all about curves 💫

Get the look with our Capella table, where soft lines meet statement design.",0,"02/03/2026 10:02",https://www.instagram.com/p/DUThnktERSf/,"IG carousel",,Lifetime,8218,43,5,3,4,2734,1
17847836262657441,17841400079643420,barkerandstonehouse,"Barker and Stonehouse","One click closer to comfort ☁️✨

Our Lomax sofa is all about space, comfort and effortless style. This generously sized corner sofa, finished in a beautifully neutral textured fabric, is made for relaxed, lived-in living.

Shop the Lomax sofa now in our Winter Sale!",7,"02/01/2026 10:30",https://www.instagram.com/reel/DTvhxaTDFqS/,"IG reel",,Lifetime,3911,52,12,3,11,2788,4
17847180111643878,17841400079643420,barkerandstonehouse,"Barker and Stonehouse","The art of shelf styling 🌿🏺

There’s no “right” way to style a shelf, but a few simple tips can help create a balanced, cohesive look. Think curated, not cluttered - mix scales, textures, and personal pieces that tell a story.

Swipe for some shelf styling inspiration!",0,"01/30/2026 08:50",https://www.instagram.com/p/DUJGR-PFEUk/,"IG carousel",,Lifetime,9184,33,0,0,7,2216,0
18082501367225379,17841400079643420,barkerandstonehouse,"Barker and Stonehouse","Where storage meets style ✨

The Fuji sideboard turns everyday storage into a design statement, with its sculptural fluted finish and refined marble top.",0,"01/29/2026 10:01",https://www.instagram.com/p/DUGpoUlid1z/,"IG image",,Lifetime,9606,14,1,0,0,3630,0
18383647192158787,17841400079643420,barkerandstonehouse,"Barker and Stonehouse","A quiet corner, perfected 🤍 We love how @marstonhome_ has styled our Talbot armchair in this beautiful space.

Is your house a Barker and Stonehouse? Tag us in your posts to be featured!",0,"01/28/2026 09:15",https://www.instagram.com/p/DUD_g1hDCyz/,"IG image",,Lifetime,8636,43,1,0,9,2542,1
17905337520179845,17841400079643420,barkerandstonehouse,"Barker and Stonehouse","Make WFH days effortlessly stylish with our Tigris and Tasso desks ✨ Which look would you choose?",0,"01/26/2026 07:01",https://www.instagram.com/p/DT-mm4AkqYn/,"IG carousel",,Lifetime,9989,39,2,2,10,2587,1
18090986350972711,17841400079643420,barkerandstonehouse,"Barker and Stonehouse","The details that make the sofa 🧡

From soft chenille fabric to perfectly plump cushions and a bold yet laid back design, it's easy to see why the Hoxton is a firm favourite.",0,"01/25/2026 01:00",https://www.instagram.com/p/DT7Yc82jFW7/,"IG carousel",,Lifetime,10502,31,7,1,9,2730,0
18096645721904712,17841400079643420,barkerandstonehouse,"Barker and Stonehouse","Unbox our Hollis chair with @_katiepeakehome

Featuring a solid wood frame and soft cream upholstery, it’s the perfect combination of comfort and style",21,"01/23/2026 09:35",https://www.instagram.com/reel/DT0lGFxDKH1/,"IG reel",,Lifetime,16248,79,2,5,23,10391,0
18106014217665986,17841400079643420,barkerandstonehouse,"Barker and Stonehouse","Cosy, but make it colourful 👌

Our Lucerne range blends warm wood and soft upholstery to create a bedroom that feels inviting and refined. We’ve styled it with pops of pink and green, bold patterns and rich textures, for a space that feels vibrant, layered and full of winter warmth.

Shop the Lucerne bedroom range now with up to 25% off in our Winter Sale!",22,"01/22/2026 02:05",https://www.instagram.com/reel/DUObQ4bDEtU/,"IG reel",,Lifetime,6436,51,10,3,8,4837,2
18304375837281328,17841407240977131,no14hectorshouse,"Jade Watkins","ad | Embracing a slow January☁️
After a busy end to the year renovating the playroom and finally finishing our new bedroom, it’s time to enjoy this cosy space. We chose some beautiful pieces from @barkerandstonehouse and couldn’t be happier with the quality. The perfect finishing touches to our newly renovated bedroom🤎

•Cecile Bed 
•Cecile Bedside tables 
•Cushions 
•Mango wood Floor lamp 
•Potted faux Olive tree 
•Tall Bobbin Table lamp 

You can shop many of these pieces in the Barker and Stonehouse Winter sale!
#barkerandstonehouse #bedroomrenovation #mycosyspace",25,"01/18/2026 10:47",https://www.instagram.com/reel/DTqZwlZjPPA/,"IG reel",,Lifetime,94630,1357,158,90,0,90301,141
17892769194401312,17841400079643420,barkerandstonehouse,"Barker and Stonehouse","Fuji in detail ✨

Our Fuji table combines warm wood and sleek marble for a perfectly balanced statement piece.

Shop the Fuji table now in our Winter Sale!",0,"01/16/2026 08:55",https://www.instagram.com/p/DTlDusbE1CA/,"IG carousel",,Lifetime,13856,25,1,1,6,2723,1
18088291822970419,17841400079643420,barkerandstonehouse,"Barker and Stonehouse","A statement in colour 🧡

Our Hoxton sofa brings a vibrant pop of orange, styled beautifully with warm woods and contrasting blues.

Shop sofas now with up to 25% off in our Winter Sale!",13,"01/14/2026 10:30",https://www.instagram.com/reel/DSxuqaUjMR0/,"IG reel",,Lifetime,23791,116,26,4,43,18098,403
18149483785448417,17841400079643420,barkerandstonehouse,"Barker and Stonehouse","Step inside the new Barker and Stonehouse store at @jarroldnorwich and discover beautifully crafted furniture, inspiring interiors, and some of our most loved brands, all under one roof.

From statement sofas to timeless dining pieces, this new space is designed to spark ideas for every room in your home.

Have you visited yet?",0,"01/14/2026 06:32",https://www.instagram.com/p/DTfpxGAkZVZ/,"IG carousel",,Lifetime,17807,48,6,0,3,79448,2
18297976207279877,17841400079643420,barkerandstonehouse,"Barker and Stonehouse","Our Niko sofa bed has transformed @leopard_print_stairs spare room into the perfect guest-ready retreat ✨ Comfort, style, and sleep sorted.",0,"01/12/2026 10:26",https://www.instagram.com/p/DTa63DGEzNL/,"IG carousel",,Lifetime,19607,21,2,1,8,4434,1
17979304211957207,17841400079643420,barkerandstonehouse,"Barker and Stonehouse","Take a peek at what’s waiting for you in our clearance event this weekend! 

Discover last-chance pieces and one-of-a-kind treasures in every store, all with an extra 10% off already-reduced prices. Pop into your nearest store and snap them up before they’re gone.",30,"01/10/2026 00:30",https://www.instagram.com/reel/DTUtI-_jDcA/,"IG reel",,Lifetime,7770,33,10,0,6,5997,1
18064472057633778,17841400079643420,barkerandstonehouse,"Barker and Stonehouse","What we see vs what you see 👀

From styling to the final shot, take a peek at how we bring our looks to life!",21,"01/08/2026 10:30",https://www.instagram.com/reel/DTLenpXjCFO/,"IG reel",,Lifetime,4665,57,8,3,9,3739,0
18070787233963021,17841400079643420,barkerandstonehouse,"Barker and Stonehouse","Workspace goals 📚🌿

Natural wood textures, soft lighting, and a few green touches make all the difference to creativity and productivity.

Tap to shop the Olav desk now in our Summer Sale!",0,"07/03/2025 08:01",https://www.instagram.com/p/DLpmDNhtpkC/,"IG carousel",,Lifetime,20606,28,0,0,9,2807,0
18214459408306933,17841400079643420,barkerandstonehouse,"Barker and Stonehouse","Summer styling made simple with light, airy neutrals ☁️🌾

Soft tones, natural textures and sun-kissed spaces that feel as calm as a costal breeze.",24,"07/01/2025 10:00",https://www.instagram.com/reel/DLkqHtEMH0S/,"IG reel",,Lifetime,4257,44,3,3,15,3566,0
18125138608535615,17841400079643420,barkerandstonehouse,"Barker and Stonehouse","If your bedroom could use a reset, this is your sign 💤

From swapping in a statement bedframe to layering cosy textures, here are 5 easy ways to transform your sleep space in 2026.

#newyearbedroom #newyearnewbedroom",0,"01/06/2026 09:40",https://www.instagram.com/p/DTLY7guk9sS/,"IG carousel",,Lifetime,16561,23,0,2,4,3745,0
18339164023238541,17841400079643420,barkerandstonehouse,"Barker and Stonehouse","Snuggle up in style ✨ January calls for cosy corners, soft textures, and a sofa that makes staying in feel like the best plan.

Shop the Montgomery recliner sofa now in our Winter Sale!",0,"01/02/2026 21:40",https://www.instagram.com/p/DTCYGohD9Fd/,"IG carousel",,Lifetime,17859,22,5,0,11,3618,1
18106207090631622,17841400079643420,barkerandstonehouse,"Barker and Stonehouse","Made for moments around the table ✨

Fuji pairs smooth marble with warm wood for a beautifully modern dining space.

Shop our dining range now with up to 25% off in our Winter Sale!",12,"01/02/2026 10:30",https://www.instagram.com/reel/DTGVDFtjHfE/,"IG reel",,Lifetime,5792,28,9,0,7,5128,2
18093053728898179,17841400079643420,barkerandstonehouse,"Barker and Stonehouse","Because some looks last a lifetime 👌",26,"01/01/2026 03:00",https://www.instagram.com/reel/DS9zLQEjCB2/,"IG reel",,Lifetime,26625,359,33,3,107,20712,436
17859393561572406,17841400079643420,barkerandstonehouse,"Barker and Stonehouse","Happy New Year from all of us at Barker and Stonehouse ✨🍾",0,"12/31/2025 09:40",https://www.instagram.com/p/DS78HFekuJ2/,"IG image",,Lifetime,19457,33,3,2,1,6577,0
17937023481108684,17841400079643420,barkerandstonehouse,"Barker and Stonehouse","Out with the clutter, in with the calm ✨

The Zerina sideboard is effortlessly stylish and practical too - perfect for a New Year reset.

Explore our range of sideboards now with up to 25% off in our Winter Sale!",0,"12/30/2025 03:30",https://www.instagram.com/p/DS4s_nnEtMs/,"IG carousel",,Lifetime,17436,24,3,0,12,3461,2
18083938970031248,17841400079643420,barkerandstonehouse,"Barker and Stonehouse","2025 in 25 seconds ✨

From exciting collaborations to a new store and so many stylish moments in between, it’s been an unforgettable year.

Thank you for following along. We can’t wait to celebrate our 80th year with you in 2026!",24,"12/29/2025 09:05",https://www.instagram.com/reel/DS2ulfCjDWy/,"IG reel",,Lifetime,4630,43,2,0,4,3927,0
18088051418287401,17841400079643420,barkerandstonehouse,"Barker and Stonehouse","Styling the Hoxton sofa🧡 

This season we're pairing our iconic Hoxton sofa with rich tones, bold cushions and art that makes a statement. Proof that cosy can be colourful!",0,"12/28/2025 09:00",https://www.instagram.com/p/DS0JMUujMKq/,"IG carousel",,Lifetime,19757,44,5,2,6,4541,0
18129399685509733,17841400079643420,barkerandstonehouse,"Barker and Stonehouse","Wishing you a very Merry Christmas from our family to yours 🎄✨",0,"12/24/2025 08:01",https://www.instagram.com/p/DSpvK-8ktUZ/,"IG image",,Lifetime,20978,34,1,1,1,5886,1
18071037074086703,17841400079643420,barkerandstonehouse,"Barker and Stonehouse","Our Zuberi coffee table is the perfect centrepiece in @our2025foreverhome's stylish living space 🤎

Is your house a Barker and Stonehouse? Tag us in your posts to be featured!",0,"12/23/2025 03:20",https://www.instagram.com/p/DSmqQqmj_kH/,"IG image",,Lifetime,17740,22,3,0,13,3412,0
18076439588192906,17841400079643420,barkerandstonehouse,"Barker and Stonehouse","Don't forget, our stores close at 5pm today for Christmas🎄Join us from 10am on Boxing Day for our Winter Sale!",0,"12/21/2025 02:00",https://www.instagram.com/p/DShXjGnDC-J/,"IG image",,Lifetime,36985,145,8,2,15,15819,2
18179505544364670,17841400582211638,jarroldnorwich,Jarrolds,"WIN A £5,000 ROOM MAKEOVER! ✨

To celebrate the opening of Jarrolds x @barkerandstonehouse, we’re giving one lucky winner the chance to transform their home with a £5,000 room makeover.

The prize includes £5,000 to spend at the brand-new Barker and Stonehouse concession in Jarrolds, Norwich, plus home accessories from Jarrolds. You’ll also get expert styling advice from Rhianon Vest, Creative Stylist at Barker and Stonehouse, to help bring your dream space to life.

Simply complete the form via the link in our bio to enter. 🏡",0,"12/19/2025 02:58",https://www.instagram.com/p/DScUlsgjVCM/,"IG image",,Lifetime,31192,302,169,41,0,,
18107545471653284,17841400079643420,barkerandstonehouse,"Barker and Stonehouse","We’re officially open in @jarroldnorwich norwich!

Come and explore an edit of our most-loved collections, thoughtfully crafted for modern living. You’ll find exclusive design galleries tailored specially for Jarrolds, alongside leading brands such as Orla Kiely, Tetrad and Stressless.

Are you ready to make your house a Barker and Stonehouse Norwich?",43,"12/18/2025 08:29",https://www.instagram.com/reel/DSaVG94jKVT/,"IG reel",,Lifetime,11559,161,11,4,9,50230,2
18145757968440174,17841400079643420,barkerandstonehouse,"Barker and Stonehouse","Winter blues? Not here 🌿🌈

We’ve styled the Zerina sideboard with bold colours and feel-good details to spark joy all season long.",19,"12/17/2025 10:30",https://www.instagram.com/reel/DSX-scSDG02/,"IG reel",,Lifetime,4422,32,6,1,8,4180,1
18096773986884164,17841400079643420,barkerandstonehouse,"Barker and Stonehouse","Christmas comfort starts here🎄

Our @englishheritage Rosa sofa has been styled beautifully by @thebakers.house. 

Is your house a Barker and Stonehouse? Tag us in your posts to be featured!",0,"12/16/2025 05:35",https://www.instagram.com/p/DSU4JVuDHSP/,"IG image",,Lifetime,21363,142,11,1,27,6709,0
18087222053089944,17841400079643420,barkerandstonehouse,"Barker and Stonehouse","Christmas is almost here, so now is the perfect time to wind down for the festive season 🎄✨

Take some time for yourself this winter by transforming your bedroom into a cosy retreat where you can snuggle up when all the festivities are said and done. 

#christmasishere #getreadyforchristmas",16,"12/15/2025 09:35",https://www.instagram.com/reel/DSSuy3KDIf-/,"IG reel",,Lifetime,168703,40,8,0,5,183665,2
18083261081026650,17841400079643420,barkerandstonehouse,"Barker and Stonehouse","Dining room inspo, but make it festive 🎄

@life_at_the_lodge
@our_durham_home
@the_gorgeous_gosforth
@modern_victorian_home
@nikkitadman

Is your dining space ready for festivities? Tag us in your posts to be featured!",0,"12/14/2025 08:43",https://www.instagram.com/p/DSQEDe9De2U/,"IG carousel",,Lifetime,18333,61,8,2,14,5251,0
18092014760497620,17841400079643420,barkerandstonehouse,"Barker and Stonehouse","A table made for memories ✨

From crumbs and crafts to giggles and gatherings, the Trinidad table handles it all, becoming the backdrop to those nostalgic family moments you’ll treasure forever.",0,"12/13/2025 08:10",https://www.instagram.com/p/DSNbg74DUZp/,"IG carousel",,Lifetime,16015,32,3,0,2,3975,0
18232689238306652,17841400079643420,barkerandstonehouse,"Barker and Stonehouse","Our Lenor sofa looks perfectly at home in @juxta.interior’s beautiful space 🧡

Is your house a Barker and Stonehouse? Tag us in your posts to be featured!",0,"12/12/2025 09:16",https://www.instagram.com/p/DSK-M1ek42s/,"IG carousel",,Lifetime,18789,111,18,3,11,5407,4
18063739619448492,17841400079643420,barkerandstonehouse,"Barker and Stonehouse","4 must-haves for making guests feel at home this Christmas 🎄

Searching for some guest room décor ideas? Treat your family and friends to a luxurious stay over the festive season with our hand-picked range of guest room must-haves.

Order now for pre-Christmas delivery! (exclusions apply)

#guestroom #guestroomdecor #guestroomdesign #guestroommakeover",0,"12/11/2025 07:01",https://www.instagram.com/p/DSIKA_OjcqZ/,"IG carousel",,Lifetime,234208,34,1,0,10,193308,7
18088062178790974,17841400079643420,barkerandstonehouse,"Barker and Stonehouse","Style the Tatton sideboard for Christmas with us🎄

Traditional greenery, soft candlelight and cosy layers bring effortlessly festive charm ✨",29,"12/10/2025 10:30",https://www.instagram.com/reel/DSF9N6WDEsQ/,"IG reel",,Lifetime,4078,27,0,1,2,3589,1
18024975803595047,17841400079643420,barkerandstonehouse,"Barker and Stonehouse","@pantone have announced their Colour of the Year for 2026; Cloud Dancer, a soft neutral hue that brings calm, clarity, and effortless style to every space 🤍

Swipe to see some of our favourite ways to style this soothing shade.",0,"12/09/2025 09:40",https://www.instagram.com/p/DSDSo-Qkjgw/,"IG carousel",,Lifetime,14851,44,10,4,16,3880,0
18073785599198933,17841400079643420,barkerandstonehouse,"Barker and Stonehouse","A sofa made for sharing ✨

Our vintage-inspired velvet Hemingway sofa captures that classic Christmas charm and sets the tone for cosy festive moments🎄",0,"12/08/2025 10:02",https://www.instagram.com/p/DSAwX5kkkC4/,"IG carousel",,Lifetime,15440,63,8,1,5,4053,2
17967056699843582,17841446142381399,leopard_print_stairs,"Laura | Leopard Print Stairs","ad I had lots of boxes I needed to tick when it came to finding the perfect sofa bed for this room, mostly revolving around its dimensions. We needed something that would fit perfectly in this empty space, large enough to seat three teens for afternoons gaming, and with enough room for two guests to spend a comfortable night or two over Christmas. 

I wasn’t prepared to compromise on comfort or style either and must have looked at dozens before I came across the Niko by @barkerandstonehouse 

I love that the minimal design gives me endless opportunities to play with colour palettes - I chose pink, burgundy and striped cushions, with the softest forest green throw for cosy movie evenings 🍿 
 
I am SO in love with this room and the sofa bed is the perfect piece tying everything together. I might just uninvite the guests and hide away here for the next few weeks! 

#sofastyling #guestroomdecor #sofabed",20,"12/07/2025 09:00",https://www.instagram.com/reel/DR-EZszjUWq/,"IG reel",,Lifetime,24045,212,29,110,0,,
18086988475991148,17841400079643420,barkerandstonehouse,"Barker and Stonehouse","Looking for tips on how to sleep better this Christmas? Get ready to upgrade your seasonal sleep routine 🎄✨

The festive season can be magical, but it can also be stressful. Late nights, long to-do lists and busy schedules can make it harder than ever to unwind and fall asleep. From refreshing your mattress to switching on the mood lighting for the perfect Christmas sleep ambience, we’re sharing some simple tips for improving your festive sleep. 

🛏️ Refresh your mattress or add a topper
A good night’s sleep starts with proper support. If your mattress is feeling a little tired, a topper can add instant comfort, extra cushioning and better pressure relief, perfect for unwinding during busy December days.

🌿 Choose natural, breathable bedding
Wool, linen and cotton help regulate your temperature, so you stay warm without overheating. Ideal for cosy winter nights when you want to feel snug but still sleep soundly.

🧣 Layer with cushions and throws
Soft textures add warmth and atmosphere. Try mixing chunky knits with soft-touch fabrics to create a restful, winter-ready cocoon.

💡 Switch to soft, ambient lighting
Warm-toned lamps, fairy lights or dimmable bulbs help signal to your body that it’s time to slow down. A gentle glow can make your bedroom feel instantly more serene.

🧺 Keep your space clutter-free
A clear room really does support a clear mind. Tidying away gifts, wrapping supplies and festive chaos creates a calm environment that helps you unwind before bed.

Goodbye festive stress, hello dreamy Christmas sleep!

#ChristmasSleep #ChristmasSleepTips #ChristmasSleeping",34,"12/06/2025 01:00",https://www.instagram.com/reel/DR6oxqNDNfm/,"IG reel",,Lifetime,121654,34,3,0,4,171812,4
18249551983293702,17841400079643420,barkerandstonehouse,"Barker and Stonehouse","Have you heard? Barker and Stonehouse is moving into Norwich's prestigious department store, Jarrolds! 🎉

Our new @jarroldnorwich concept space will feature a curated mix of our best-selling sofas, dining, bedroom, and occasional pieces, plus an edit of our most loved brands, thoughtfully crafted for modern living. 

Phase one is now open, so if you're in Norwich, pop by and get a sneak peek! You can find us on the 2nd floor.

There's even more to come - stay tuned for our official opening day on 18th December!",18,"12/05/2025 08:00",https://www.instagram.com/reel/DR4z_rgDEEP/,"IG reel",,Lifetime,14849,243,28,5,14,9948,8
17906798172281024,17841400079643420,barkerandstonehouse,"Barker and Stonehouse","Take a look at the items we’re adding to our wishlist this winter ✨

From statement stripy cushions to colourful candlesticks and soft throws, were loving piece that add cosiness and joy to our homes this season. 

Which items are you adding to your wishlist?",39,"12/04/2025 10:30",https://www.instagram.com/reel/DR2gb_ejHga/,"IG reel",,Lifetime,26424,169,6,8,58,18379,97
18052953746661933,17841400079643420,barkerandstonehouse,"Barker and Stonehouse","Where classic design meets childhood joy ✨

This Christmas, our vintage-inspired pieces set the scene for the sweetest festive memories and the kind of Christmas moments that feel like they’ve been pulled straight from an old family album 🎄❤️",25,"12/03/2025 09:00",https://www.instagram.com/reel/DRzxThUjA94/,"IG reel",,Lifetime,16445,260,21,4,2,13399,271
