"Post ID","Account ID","Account username","Account name",Description,"Duration (sec)","Publish time",Permalink,"Post type","Data comment",Date,Views,Likes,Shares,Comments,Saves,Reach,Follows
17951164877934470,17841400079643420,barkerandstonehouse,"Barker and Stonehouse","Sink into comfort with the Nicolo chair 🤎 It's soft curves are made for slow moments.",0,"01/07/2026 09:01",https://www.instagram.com/p/DTN5QaEkmza/,"IG carousel",,Lifetime,16370,45,3,5,14,3499,0
18115535062850429,17841434051990545,my.lymingtonhome,"Shannon • Home DIY & Lifestyle 🤍","Ad The sun finally made an appearance, so naturally I abandoned my extremely long to do list and claimed my spot in the garden 🌞 

I’ve been obsessed with this egg chair from @barkerandstonehouse It’s one of those pieces that instantly makes your outdoor space feel like a little retreat. Stylish, comfortable and perfect for those moments when you just need to switch off and enjoy the sunshine! 

Now if anyone needs me, I’ll be right here… doing absolutely nothing 🙃✨",24,"06/23/2026 09:45",https://www.instagram.com/reel/DZ74F8hsv4V/,"IG reel",,Lifetime,3495,45,1,15,0,,
18157069840462968,17841400079643420,barkerandstonehouse,"Barker and Stonehouse","Our Lomax sofa is the ultimate place to lounge this season, whether you’re kicking back with a quiet cuppa or having the whole squad round for a summer of sport ☀️

Combining generous comfort with a customisable modular design, you can style it, arrange it, and make it completely yours.",0,"06/22/2026 10:01",https://www.instagram.com/p/DZ5VOggDaca/,"IG carousel",,Lifetime,3070,15,4,0,0,1444,1
18056712815739238,17841400079643420,barkerandstonehouse,"Barker and Stonehouse","This is your reminder🚨

Pop into your local Barker and Stonehouse this week and scan the QR code for a chance to win a £5,000 furniture voucher, £200 furniture voucher, £50 off every £1000 you spend or free delivery🥳

Hurry…only 9 days left!",11,"06/21/2026 01:30",https://www.instagram.com/reel/DZ116E0u25p/,"IG reel",,Lifetime,1803,19,0,0,0,1460,0
18099856811129283,17841400079643420,barkerandstonehouse,"Barker and Stonehouse","Summer just got a little more exciting ☀️

Visit your local Barker & Stonehouse for the chance to win a prize such as a £5,000 furniture voucher, £200 furniture voucher, £50 off every £1000 you spend or free delivery😆

1️⃣ Scan & screenshot: Scan the QR code and save your result.

2️⃣ Shop your prize: Choose the item you’d like to put it towards.

3️⃣ Show & redeem: Show your screenshot to a team member at checkout.

Pop in store, take part, and see what you could win🥳",29,"06/20/2026 01:30",https://www.instagram.com/reel/DZzRL4juxCp/,"IG reel",,Lifetime,2620,18,1,1,0,1980,0
17951302545172386,17841400079643420,barkerandstonehouse,"Barker and Stonehouse","Summer has well and truly arrived ☀️

Make the most of the season with a fresh new look for your home. Enjoy 25% off all furniture, up to 50% off clearance, and 70% off accessories in our Summer Sale. 

Shop online and in store from tomorrow.",16,"06/19/2026 01:30",https://www.instagram.com/reel/DZzRJlbugfA/,"IG reel",,Lifetime,2824,35,3,3,0,1969,0
17907975834427579,17841400079643420,barkerandstonehouse,"Barker and Stonehouse","Have you received your copy of The Summer Times yet? ☀️

Packed with all the inspiration you need for the season ahead, it’s your go-to guide for summer style.

Plus, there’s an extra summer gift waiting for you🤭",26,"06/18/2026 09:31",https://www.instagram.com/reel/DZu-imYCRO-/,"IG reel",,Lifetime,2161,15,0,0,1,1704,0
18074992001665541,17841400079643420,barkerandstonehouse,"Barker and Stonehouse","Designed for slow mornings and cosy evenings, the Providence modular corner sofa brings effortless comfort and understated style to your space.

Image credit: @life_at_the_lodge",0,"06/16/2026 10:30",https://www.instagram.com/p/DZp7vG7G1Qq/,"IG carousel",,Lifetime,5181,53,0,3,2,2542,0
18099519296146191,17841400079643420,barkerandstonehouse,"Barker and Stonehouse","Summer is coming…and so is our Summer Sale! Offers start Saturday in store and online.",16,"06/15/2026 10:00",https://www.instagram.com/reel/DZnTgfmOo8z/,"IG reel",,Lifetime,1729,22,0,2,0,1349,0
18001351610943418,17841400079643420,barkerandstonehouse,"Barker and Stonehouse","This is your sign…to refresh your space for less ✨

Save 20% off all accessories online and in store, plus up to 70% off selected pieces in store only.",28,"06/14/2026 01:30",https://www.instagram.com/reel/DZj0VyNOwWU/,"IG reel",,Lifetime,5799,39,0,0,6,4827,1
18094021085582191,17841400079643420,barkerandstonehouse,"Barker and Stonehouse","Eighty years after the famous @ercol_uk Windsor Chair first appeared in Barker and Stonehouse stores, the partnership between our two brands continues to evolve.

With the next generation now shaping the future, the collaboration remains rooted in the same foundations that started it all: family values, thoughtful design and a belief that great furniture should stand the test of time.",75,"06/12/2026 09:54",https://www.instagram.com/reel/DZff9uLOdCN/,"IG reel",,Lifetime,2389,35,2,0,2,1865,0
18090615560165143,17841404850706638,behindnumberdeux,"Nisha | Interiors & Lifestyle","Ad | Timeless design, beautiful craftsmanship, and chairs you’ll never tire of 🤎✨ Meet the Reina dining chairs from @barkerandstonehouse.

📌 Save for future. Link to the exact dining chairs on my stories.

Dining Chairs | Dining Room | Dining Area | Dining Room Inspo | Rattan Chair | Timeless Interiors | Vintage Art |
Vintage Interiors | Country Living | Nancy Meyers | Open Plan | Family Room | Victorian home style | Historic home | Classic design | Elegant home | English country house | Heritage home | Studio McGee Style | Vintage Interiors | Collected home, Interior design | Old-world elegance | Modern Heritage 

#diningroom #diningroominspo #diningchair #diningchairs #openplanliving",7,"06/09/2026 22:00",https://www.instagram.com/reel/DZZJMwUhjul/,"IG reel",,Lifetime,27637,575,52,220,0,,
18096062293960385,17841400079643420,barkerandstonehouse,"Barker and Stonehouse","Burl is having a moment 🤎

With its wood grain texture and retro soul, our Castille burl-effect coffee table brings instant character to any space.",0,"06/09/2026 09:02",https://www.instagram.com/p/DZXwHmeDAys/,"IG carousel",,Lifetime,3835,24,2,0,4,1682,0
17919730395165456,17841404082402912,toby_rex_thegingerduo,"The Gingers & Jenn 🧡 🐾","PSA - @barkerandstonehouse stores are dog friendly! 🛋️ 🐾 

Come with us for a browse, a nap and some lunch at the Teesside Park branch. 🥗 💤 👅 

Ad. 

#dogsofinstagram #dogfriendly #barkerandstonehouse #interior #doglover",61,"06/06/2026 02:26",https://www.instagram.com/reel/DZPTrJdto8s/,"IG reel",,Lifetime,15607,121,15,12,0,,
18102268550028420,17841400079643420,barkerandstonehouse,"Barker and Stonehouse","There’s a reason @ercol_uk pieces made decades ago are still treasured in homes today. 

As this story from Henry Tadros shows, quality, craftsmanship and longevity have never been an afterthought - they’ve always been at the heart of everything ercol does.",52,"06/05/2026 08:40",https://www.instagram.com/reel/DZNabi_uAPp/,"IG reel",,Lifetime,3117,38,6,0,1,2350,1
18474044884103885,17841400079643420,barkerandstonehouse,"Barker and Stonehouse","Give your dining space a fresh new feel with the perfect chairs.

Shop now and save up to 20% when you buy 4 or more from our selected range, for a limited time only!",0,"06/04/2026 09:03",https://www.instagram.com/p/DZK4MRtjEgS/,"IG carousel",,Lifetime,3401,15,0,0,2,1584,0
18086507768632957,17841400079643420,barkerandstonehouse,"Barker and Stonehouse","POV: you’ve just found your new favourite sofa 🛋️

Styling the Lomax, the definition of laid-back luxury…soft curves, sink-in comfort and modular design made for slow mornings, movie nights and everything in between.

The kind of sofa that makes you want to stay home a little longer 🏡",24,"06/02/2026 10:30",https://www.instagram.com/reel/DZAvDacu0Vm/,"IG reel",,Lifetime,2011,23,1,0,3,1626,0
18105057821060490,17841400079643420,barkerandstonehouse,"Barker and Stonehouse","A visit to beautiful Norwich isn’t complete without stepping inside the iconic @jarroldnorwich ✨

And now there’s even more reason to stop by - the newest Barker and Stonehouse concession store is waiting, filled with our latest collections to inspire your interior.

Find us on the second floor 📍",24,"06/01/2026 10:00",https://www.instagram.com/reel/DY7h_VouSSb/,"IG reel",,Lifetime,5998,124,6,2,6,4664,2
18592616425042443,17841404850706638,behindnumberdeux,"Nisha | Interiors & Lifestyle","Ad | A classic tablescape that will never go out of style ✨

You know those days when you’re hosting and the LAST thing you’ve thought about is the tablescape? 😅 You don’t need a full-blown Pinterest-worthy setup to make a table feel beautiful — just a few timeless essentials that can be styled differently season after season 🌿.

A placemat, napkin, napkin ring, candlelight and a simple floral centrepiece — proof that sometimes less really is more 🤍

But to make a tablescape feel timeless, you need to get the foundation right first — a solid wooden table and classic dining chairs. My Reina dining chairs from @barkerandstonehouse with their beautiful rattan backs are the perfect addition ✨

📌 Save this for your next last-minute hosting moment.

Timeless Interiors | Vintage Art | Vintage Interiors | Country Living | Nancy Meyers | Open Plan | Family Room | Victorian home style | Historic home | Classic design | Elegant home | English country house | Heritage home | Studio McGee Style | Vintage Interiors | Collected home, Interior design | Old-world elegance | Kitchen Remodel | Kitchen Inspo | Kitchen Design Ideas | Kitchen Renovation | Dinner Table Styling | Dining Table Inspo | Timeless Tablescape | Table Setting | Modern Heritage",0,"05/30/2026 23:00",https://www.instagram.com/p/DY_gFKyDLGg/,"IG carousel",,Lifetime,17706,243,5,190,0,,
18412037416146683,17841406875494381,life_at_the_lodge,"Life At The Lodge","AD. Come and style my sofa with me.

Styling the new Providence corner sofa couldn’t be easier for that instantly elevated look. The perfectly paired cushions just need a quick plump for a refined, fully styled feel in seconds.

I’ve added Barker and Stonehouse lanterns for a soft Balearic inspired touch, effortless style with minimal effort.

Finished with a relaxed linen throw draped over the sofa, perfect for cosy evenings when the temperature cools down. 

Effortless, easy, styling, all day long.

#sofastyle #neutralhome #neutralkitchen #modularsofa #neutralsofa",28,"05/30/2026 00:01",https://www.instagram.com/reel/DY9B7h2IReN/,"IG reel",,Lifetime,10517,118,10,41,0,,
17930456193298731,17841400079643420,barkerandstonehouse,"Barker and Stonehouse","Few design partnerships stand the test of time, but the relationship between Barker and Stonehouse and ercol has endured for more than 80 years. Built on shared values of craftsmanship, quality and thoughtful design, it is a collaboration that has shaped British interiors for generations.

With the fourth generation now stepping forward in both family businesses, George Barker and Henry Tadros reflect on the 80 year journey together.",54,"05/29/2026 09:00",https://www.instagram.com/reel/DY7bFysODpp/,"IG reel",,Lifetime,4303,71,7,3,2,3259,3
17925638901342977,17841400079643420,barkerandstonehouse,"Barker and Stonehouse","Garden season starts here… 🌿

From laid-back lounge sets to alfresco dining favourites, our latest outdoor collection is in store and ready for summer hosting, slow mornings and sunny evenings🌞

Visit your nearest Barker and Stonehouse store to shop the collection 🛒",20,"05/28/2026 09:30",https://www.instagram.com/reel/DY45yPSOlQE/,"IG reel",,Lifetime,4824,35,1,0,4,4152,0
18092860433582599,17841400079643420,barkerandstonehouse,"Barker and Stonehouse","Our accessories clearance event is now on! 📢 Shop now for up to 70% off finishing touches to make your house feel like a home.",0,"05/27/2026 10:30",https://www.instagram.com/p/DY2b076DHEU/,"IG carousel",,Lifetime,10037,41,9,0,3,4259,0
18004385054926725,17841400079643420,barkerandstonehouse,"Barker and Stonehouse","Where you'll find us this week ☀️

From morning coffee to sunset drinks, our garden furniture is made for every outdoor moment 🌿",0,"05/26/2026 09:03",https://www.instagram.com/p/DYztAaKlgHQ/,"IG carousel",,Lifetime,3895,31,1,1,3,1852,0
18410774620146693,17841400079643420,barkerandstonehouse,"Barker and Stonehouse","From beautifully crafted beds to on‑trend bedside tables, discover our spring favourites designed to bring effortless style and comfort to your bedroom.

Celebrate 80 years of us this spring with up to 19.46% off our latest collections. But hurry - offers end Bank Holiday Monday!",22,"05/24/2026 01:00",https://www.instagram.com/reel/DYtsOgSuQSL/,"IG reel",,Lifetime,3354,29,3,1,6,2880,0
17998880045951286,17841406875494381,life_at_the_lodge,"Life At The Lodge","AD - Bank holiday bliss.

Escape to effortless Mediterranean inspired living with the Tavira garden dining table and chairs, where laid back luxury meets contemporary style. With its timeless design and beautifully refined detailing, this statement set captures the essence of long sun soaked alfresco lunches, warm evenings, and relaxed outdoor entertaining. 

The perfect dining set ready to transform your outdoor space, into a chic Mediterranean retreat with an island feel.",31,"05/23/2026 04:00",https://www.instagram.com/reel/DYrb6Usoane/,"IG reel",,Lifetime,17749,312,21,68,0,,
17947843296176125,17841400079643420,barkerandstonehouse,"Barker and Stonehouse","When our beach photoshoot made the local news, we just had to come back - and this time, we brought gifts! 🎁 

Huge thank you to the people of Saltburn-by-the-Sea for being such great fun and making us feel so welcome!",32,"05/22/2026 08:09",https://www.instagram.com/reel/DYpTWkHsxr7/,"IG reel",,Lifetime,6015,92,17,3,2,4243,0
18147099007497974,17841400079643420,barkerandstonehouse,"Barker and Stonehouse","Throwback to filming day! 🎬

Wondering what inspired our new TV ad, ‘The Curtain Twitchers’? Find out the story behind number 46, as we celebrate our 80th anniversary.",66,"05/19/2026 09:50",https://www.instagram.com/reel/DYhw6UEuqA-/,"IG reel",,Lifetime,4401,71,17,7,6,3376,4
17882782563418213,17841400079643420,barkerandstonehouse,"Barker and Stonehouse","UP TO 70% OFF ACCESSORIES 📢

Now's the perfect time to refresh your home décor for less with our big accessories clearout! Save 20% off all accessories online and in store. PLUS up to 70% off selected items in stores only!

From statement clocks and lighting to stylish wall art, mirrors and more – there are some real bargains to be found.",0,"05/18/2026 08:31",https://www.instagram.com/p/DYfDHE9ALKy/,"IG image",,Lifetime,2923,15,2,0,3,1915,0
17867938725619168,17841406875494381,life_at_the_lodge,"Life At The Lodge","AD New sofa day

Introducing the Providence sofa from @barkerandstonehouse a piece that completely transformed the space.

From the moment I saw the Providence, it was love at first sight. The timeless design, the detailing, the effortless style, it was exactly the look I had envisioned for our open plan living space.

Comfort was just as important to me as aesthetics, and this sofa truly delivers both. Deep, luxurious, and unbelievably comfortable, the kind of sofa everyone naturally gravitates to.

I love the modular design for its versatility and perfectly tailored feel within the room, alongside the endless fabric options that made the whole process feel so personal and bespoke.

We chose the Tyne Bouclé in Sand, the most beautiful soft neutral that brings warmth and light to the space whilst still feeling practical for everyday living. Finished with matching scatter cushions and additional touches of Ryeland Latte for added texture.

A forever piece, that was made for this space.

#modularsofa #newsofa #britishdesign #interiordesign #openplanliving",30,"05/15/2026 23:49",https://www.instagram.com/reel/DYY9mAOIKTd/,"IG reel",,Lifetime,14214,154,15,45,0,,
17993826350959209,17841400079643420,barkerandstonehouse,"Barker and Stonehouse","Country styling, timeless design🤎

Crafted from beautifully reclaimed timber, the Covington Bench brings warmth, character and that perfectly lived-in feel to every dining space. 

Think slow mornings, long lunches and cosy evenings spent together.

Shop the Covington collection now🛒",18,"05/14/2026 09:02",https://www.instagram.com/reel/DYUzVprMniX/,"IG reel",,Lifetime,9475,30,2,2,1,7250,1
17979902967008147,17841409465920317,stripesinthecity,Anna,"New dining chair unboxing 🫶🏻✨🙌🏻

We are redoing our banquette seating area! I haven’t spoken about it in detail on here properly yet but you may have heard me on stories talking about our new cushions that are currently being made. We did the seating area quite quickly just after we’d moved in so that we’d have somewhere to sit and eat after a long day of renovating which was definitely the right call. 
However, now that we’ve been in the house a little while it’s in need of some modifications and a bit of work. We actually have some new plinth on order, someone is coming to sort out our flooring once and for all and James is going to redo the actual bench seating. We’re also going to change the art to something a bit more sympathetic to the space, possibly two stacked frames and I also need to do some painting touch ups. 

So lots going on and lots to look forward to, so I hope you’ll stick around ✨ 

The beautiful new chair is from @barkerandstonehouse and it was a pr gift 🫶🏻",86,"05/14/2026 08:51",https://www.instagram.com/reel/DYUx94gs2nZ/,"IG reel",,Lifetime,10675,197,2,35,7,,
18051244145739067,17841400079643420,barkerandstonehouse,"Barker and Stonehouse","Say hello to Clover, the latest addition to our @englishheritage sofa range 🌼

Clover is inspired by English Heritage's conservation work to restore England's wildflower meadows.

The sofa’s design, with neat scroll arms and gently curved back cushions, offers tactile comfort, and comes in a choice of soft� linen or classic distressed chenille.",0,"05/12/2026 10:01",https://www.instagram.com/p/DYPwhB-juCo/,"IG carousel",,Lifetime,3817,22,2,1,3,1930,0
18099906092092065,17841400079643420,barkerandstonehouse,"Barker and Stonehouse","It’s all in the details ✨

Those vintage finds, treasured pieces and little touches that make a house feel like home.",20,"05/11/2026 10:30",https://www.instagram.com/reel/DYFgvZPuVFW/,"IG reel",,Lifetime,2201,29,1,0,0,1910,2
18110056820495244,17841400079643420,barkerandstonehouse,"Barker and Stonehouse","Meet the stars of our latest TV ad ✨ From bold dining sets to effortlessly stylish console tables, designed to elevate every corner of your home.",20,"05/10/2026 07:55",https://www.instagram.com/reel/DYKYoC8ucDU/,"IG reel",,Lifetime,1966,31,0,0,3,1623,1
18105049259510784,17841406875494381,life_at_the_lodge,"Life At The Lodge","AD Come sofa shopping with me at Barker and Stonehouse.

I’m currently searching for a new sofa. Comfort is the priority, alongside a modular design and a timeless aesthetic that will work beautifully for years to come.

So naturally, I headed @barkerandstonehouse , known for their beautifully curated furniture and focus on quality craftsmanship. With so many stunning designs to choose from, I knew this was going to be a very good day.

What I loved most was how customisable everything felt. From the fabric choices to the different configurations, it really felt like I could create something perfectly suited to my space and style. The staff were so friendly knowledgeable too, talking me through all the options and helping bring my vision to life.

After browsing, I headed up to Chadwick & Co for a bite to eat while I thought over my favourites and made my final decision.

Can you guess which one I chose? There are definitely a few clues throughout… 

#newsofa #sofadesign #barkerandstonehouse #sofashopping",45,"05/08/2026 23:02",https://www.instagram.com/reel/DYG2i69o7fu/,"IG reel",,Lifetime,11610,104,7,32,0,,
18092908454228044,17841400079643420,barkerandstonehouse,"Barker and Stonehouse","Milan Design Week 2026: through the eyes of our Creative Director 🇮🇹

Swipe to see the colours, textures and details that caught our attention this year. Stay tuned to see where this inspiration takes us next...",0,"05/08/2026 09:30",https://www.instagram.com/p/DYFZ2sFDJEN/,"IG carousel",,Lifetime,6681,66,21,7,8,3230,1
17919497424146840,17841400079643420,barkerandstonehouse,"Barker and Stonehouse","Round tables + neutral chairs = the perfect combination 👌

Swipe to see some of our favourite dining looks, styled by you.

@martabarlettatheone
@herlondonresidence
@atnumberfiftyseven
@athomewiththenicholsfamily
@our2025foreverhome",0,"05/07/2026 08:30",https://www.instagram.com/p/DYCuMUjjbxw/,"IG carousel",,Lifetime,6950,42,5,1,4,3324,0
18076817903192819,17841400079643420,barkerandstonehouse,"Barker and Stonehouse","Style the Savernake Bookcase with us📚

For our Club Classic look, we combined modern favourites with vintage finds, layering old and new to create a look that feels timeless yet personal.

Save this for your next shelf refresh 🙌🏼",24,"05/06/2026 10:30",https://www.instagram.com/reel/DX7NiyfOCA-/,"IG reel",,Lifetime,1870,22,0,2,2,1691,0
18093612710177819,17841458466454655,houseofhetheringtons,"Georgia Hetherington | House of Hetheringtons","ad @barkerandstonehouse UNDERSTOOD the brief...

...to feel like we’re on holiday at home 🍓

Obsessed with our dreamy new outdoor set up. I head back to work after 13 months on maternity leave in two weeks and the idea of attending Zoom meetings from the comfort of our new patio is making that prospect a little bit easier ☕ 💻

I have been so impressed with the quality of this set, and not to mention it came fully assembled, which made the whole process SO much easier. The delivery guys were great and brought it right to our garden, I didn’t even need to lift a finger!

#patioinspo #patiofurniture #gardeninspo #barkerandstonehouse",0,"05/03/2026 23:15",https://www.instagram.com/p/DX6AT27DXxO/,"IG carousel",,Lifetime,,97,4,33,0,,
18079878599431291,17841400079643420,barkerandstonehouse,"Barker and Stonehouse","Bank Holiday plans: sorted 🌿☀️

Stretch out, soak up the sun and make the most of the long weekend with our garden collection. 

Shop this weekend and save an extra £50 off when you spend £500 on garden furniture.",0,"05/03/2026 01:01",https://www.instagram.com/p/DX3np3bDQ_t/,"IG carousel",,Lifetime,4935,34,0,3,0,2411,0
18043297823556091,17841400079643420,barkerandstonehouse,"Barker and Stonehouse","Did you know you can now shop Barker and Stonehouse at Jarrolds Norwich?

@jarroldnorwich is a true icon that has been part of the city since 1770, and we’re proud to be part of the story.

Come and take a look around, we think you’ll love it!

📍 Barker and Stonehouse, Jarrolds Department Store, 1-11 London Street, Norwich.",31,"05/02/2026 02:30",https://www.instagram.com/reel/DX1NBLyu5QD/,"IG reel",,Lifetime,9142,97,2,1,1,7255,7
18071376056306300,17841458466454655,houseofhetheringtons,"Georgia Hetherington | House of Hetheringtons","ad Pass the Lays and Fanta Lemon, cus this new set-up is giving HOLIDAY 🌞🍋

I’m THRILLED with our new outdoor furniture from @barkerandstoneshouse. I’m the most antisocial person you’ll ever meet, but you best believe I’ve been inviting people round non-stop since this was delivered and everyone’s said it makes them feel like they’re on holiday. It’s such a beautiful set - the shape, the colour, the material, everything! Not to mention the adjustable table, making it perfect for both casual drinks, or al fresco dining. 

If you need me this summer, find me here 🍹

#patioinspo #patiofurniture #gardeninspo #barkerandstonehouse",13,"04/30/2026 23:00",https://www.instagram.com/reel/DXyQKWFM3ur/,"IG reel",,Lifetime,128451,469,67,64,0,,
18085965296577952,17841400079643420,barkerandstonehouse,"Barker and Stonehouse","Spring Mood: Modern Metallics ✨

From statements pieces to accent accessories, metallics are shining this season. These re-imagined finishes feel fresh, calm and considered.",0,"04/30/2026 09:45",https://www.instagram.com/p/DXw1OIeDJm7/,"IG carousel",,Lifetime,4020,23,2,0,5,1917,1
18208480741328957,17841400079643420,barkerandstonehouse,"Barker and Stonehouse","Spring hosting starts here 🌿🍸

This Bank Holiday weekend, impress your guests with fresh florals, vintage touches and glassware worth showing off.",19,"04/28/2026 10:30",https://www.instagram.com/reel/DXrwv64OPeA/,"IG reel",,Lifetime,1941,21,2,0,2,1714,0
18117803734662258,17841400079643420,barkerandstonehouse,"Barker and Stonehouse","The perfect outdoor escape 🍷🌼

A serene, sun‑kissed retreat brought to life with our Sirmione corner set styled by @katesgeorgianhome.",0,"04/26/2026 03:00",https://www.instagram.com/p/DXlzsX4mtHr/,"IG carousel",,Lifetime,5641,63,3,8,3,2835,0
18069829586437276,17841400079643420,barkerandstonehouse,"Barker and Stonehouse","Style notes for your spring bedroom🌷

Update your sleep space with fresh textures, soft layers and a calming colour palette for slower mornings and softer evenings.",0,"04/25/2026 10:00",https://www.instagram.com/p/DXj-95GmoE6/,"IG carousel",,Lifetime,4668,31,2,3,11,2219,4
